{"$id":"https://surfaces.dev/schemas/p4/review-judgment-fixture.v0.schema.json","$schema":"https://json-schema.org/draft/2020-12/schema","allOf":[{"if":{"properties":{"fixtureKind":{"const":"surfaceops-decision"}},"required":["fixtureKind"]},"then":{"properties":{"decision":{"properties":{"catalogOverride":{"oneOf":[{"type":"null"},{"properties":{"promotionStatus":{"enum":["allowed","blocked","review_required"]},"targetPath":{"minLength":1,"pattern":"^(?!.*(?:^|/)\\.\\.(?:/|$))(?!.*(?:^|/)\\.(?:/|$))(?!.*//)[A-Za-z0-9._@-]+(?:/[A-Za-z0-9._@-]+)*$","type":"string"}},"required":["targetPath","promotionStatus"],"type":"object","unevaluatedProperties":false}]},"decisionId":{"pattern":"^[a-z][a-z0-9.-]*$","type":"string"},"decisionKey":{"minLength":1,"type":"string"},"evidenceRefs":{"items":{"properties":{"hash":{"pattern":"^[a-f0-9]{64}$","type":"string"},"hashAlgorithm":{"const":"sha256"},"path":{"minLength":1,"pattern":"^(?!.*(?:^|/)\\.\\.(?:/|$))(?!.*(?:^|/)\\.(?:/|$))(?!.*//)[A-Za-z0-9._@-]+(?:/[A-Za-z0-9._@-]+)*$","type":"string"},"schemaId":{"minLength":1,"type":"string"},"sourceEvidenceHash":{"pattern":"^[a-f0-9]{64}$","type":"string"},"sourceRef":{"type":["string","null"]}},"required":["path","schemaId","hashAlgorithm","hash"],"type":"object","unevaluatedProperties":false},"type":"array"},"execution":{"allOf":[{"if":{"properties":{"authorized":{"const":false}},"required":["authorized"]},"then":{"properties":{"callbacks":{"items":{"type":"string"},"maxItems":0,"type":"array"},"connectorCalls":{"items":{"type":"string"},"maxItems":0,"type":"array"},"fileEdits":{"items":{"type":"string"},"maxItems":0,"type":"array"},"networkCalls":{"items":{"type":"string"},"maxItems":0,"type":"array"},"secrets":{"items":{"type":"string"},"maxItems":0,"type":"array"},"shellCommands":{"items":{"type":"string"},"maxItems":0,"type":"array"},"toolCalls":{"items":{"type":"string"},"maxItems":0,"type":"array"}}}}],"properties":{"authorized":{"type":"boolean"},"callbacks":{"items":{"type":"string"},"type":"array"},"connectorCalls":{"items":{"type":"string"},"type":"array"},"fileEdits":{"items":{"type":"string"},"type":"array"},"networkCalls":{"items":{"type":"string"},"type":"array"},"reason":{"minLength":1,"type":"string"},"secrets":{"items":{"type":"string"},"type":"array"},"shellCommands":{"items":{"type":"string"},"type":"array"},"toolCalls":{"items":{"type":"string"},"type":"array"}},"required":["authorized","reason","shellCommands","toolCalls","connectorCalls","networkCalls","fileEdits","secrets","callbacks"],"type":"object","unevaluatedProperties":false},"fixtureRef":{"properties":{"path":{"minLength":1,"pattern":"^(?!.*(?:^|/)\\.\\.(?:/|$))(?!.*(?:^|/)\\.(?:/|$))(?!.*//)[A-Za-z0-9._@-]+(?:/[A-Za-z0-9._@-]+)*$","type":"string"},"schemaId":{"const":"review-judgment-fixture.v0"},"sourceRef":{"minLength":1,"type":"string"}},"required":["path","schemaId","sourceRef"],"type":"object","unevaluatedProperties":false},"hiddenState":{"oneOf":[{"type":"null"},{"additionalProperties":true,"minProperties":1,"type":"object"}]},"rationale":{"maxLength":500,"minLength":1,"type":"string"},"requestedChanges":{"items":{"minLength":1,"type":"string"},"maxItems":8,"type":"array"},"reviewItemId":{"pattern":"^[a-z][a-z0-9.-]*$","type":"string"},"secondReviewRequired":{"type":"boolean"},"status":{"enum":["approved","rejected","changes_requested","deferred"]}},"required":["decisionId","decisionKey","reviewItemId","status","rationale","requestedChanges","evidenceRefs","fixtureRef","secondReviewRequired","execution","catalogOverride","hiddenState"],"type":"object","unevaluatedProperties":false},"finding":{"type":"null"}}}},{"if":{"properties":{"fixtureKind":{"const":"judgmentkit-evaluation"}},"required":["fixtureKind"]},"then":{"properties":{"decision":{"type":"null"},"finding":{"properties":{"affectedArtifactPaths":{"items":{"minLength":1,"pattern":"^(?!.*(?:^|/)\\.\\.(?:/|$))(?!.*(?:^|/)\\.(?:/|$))(?!.*//)[A-Za-z0-9._@-]+(?:/[A-Za-z0-9._@-]+)*$","type":"string"},"minItems":1,"type":"array"},"authority":{"properties":{"approves":{"type":"boolean"},"defers":{"type":"boolean"},"executes":{"type":"boolean"},"mutates":{"type":"boolean"},"overridesPolicy":{"type":"boolean"},"promotes":{"type":"boolean"},"rejects":{"type":"boolean"},"renders":{"type":"boolean"},"requestsChanges":{"type":"boolean"},"routes":{"type":"boolean"}},"required":["approves","rejects","requestsChanges","defers","routes","promotes","mutates","renders","executes","overridesPolicy"],"type":"object","unevaluatedProperties":false},"dimension":{"enum":["activity_fit","contract_quality","evidence_quality","handoff_quality"]},"evidenceRefs":{"items":{"properties":{"hash":{"pattern":"^[a-f0-9]{64}$","type":"string"},"hashAlgorithm":{"const":"sha256"},"path":{"minLength":1,"pattern":"^(?!.*(?:^|/)\\.\\.(?:/|$))(?!.*(?:^|/)\\.(?:/|$))(?!.*//)[A-Za-z0-9._@-]+(?:/[A-Za-z0-9._@-]+)*$","type":"string"},"schemaId":{"minLength":1,"type":"string"},"sourceEvidenceHash":{"pattern":"^[a-f0-9]{64}$","type":"string"},"sourceRef":{"type":["string","null"]}},"required":["path","schemaId","hashAlgorithm","hash"],"type":"object","unevaluatedProperties":false},"minItems":1,"type":"array"},"findingId":{"pattern":"^[a-z][a-z0-9.-]*$","type":"string"},"rationale":{"minLength":1,"type":"string"},"result":{"enum":["pass","warn","fail"]},"severity":{"enum":["info","warning","error"]}},"required":["findingId","dimension","severity","result","rationale","evidenceRefs","affectedArtifactPaths","authority"],"type":"object","unevaluatedProperties":false}}}}],"properties":{"decision":{"oneOf":[{"properties":{"catalogOverride":{"oneOf":[{"type":"null"},{"properties":{"promotionStatus":{"enum":["allowed","blocked","review_required"]},"targetPath":{"minLength":1,"pattern":"^(?!.*(?:^|/)\\.\\.(?:/|$))(?!.*(?:^|/)\\.(?:/|$))(?!.*//)[A-Za-z0-9._@-]+(?:/[A-Za-z0-9._@-]+)*$","type":"string"}},"required":["targetPath","promotionStatus"],"type":"object","unevaluatedProperties":false}]},"decisionId":{"pattern":"^[a-z][a-z0-9.-]*$","type":"string"},"decisionKey":{"minLength":1,"type":"string"},"evidenceRefs":{"items":{"properties":{"hash":{"pattern":"^[a-f0-9]{64}$","type":"string"},"hashAlgorithm":{"const":"sha256"},"path":{"minLength":1,"pattern":"^(?!.*(?:^|/)\\.\\.(?:/|$))(?!.*(?:^|/)\\.(?:/|$))(?!.*//)[A-Za-z0-9._@-]+(?:/[A-Za-z0-9._@-]+)*$","type":"string"},"schemaId":{"minLength":1,"type":"string"},"sourceEvidenceHash":{"pattern":"^[a-f0-9]{64}$","type":"string"},"sourceRef":{"type":["string","null"]}},"required":["path","schemaId","hashAlgorithm","hash"],"type":"object","unevaluatedProperties":false},"type":"array"},"execution":{"allOf":[{"if":{"properties":{"authorized":{"const":false}},"required":["authorized"]},"then":{"properties":{"callbacks":{"items":{"type":"string"},"maxItems":0,"type":"array"},"connectorCalls":{"items":{"type":"string"},"maxItems":0,"type":"array"},"fileEdits":{"items":{"type":"string"},"maxItems":0,"type":"array"},"networkCalls":{"items":{"type":"string"},"maxItems":0,"type":"array"},"secrets":{"items":{"type":"string"},"maxItems":0,"type":"array"},"shellCommands":{"items":{"type":"string"},"maxItems":0,"type":"array"},"toolCalls":{"items":{"type":"string"},"maxItems":0,"type":"array"}}}}],"properties":{"authorized":{"type":"boolean"},"callbacks":{"items":{"type":"string"},"type":"array"},"connectorCalls":{"items":{"type":"string"},"type":"array"},"fileEdits":{"items":{"type":"string"},"type":"array"},"networkCalls":{"items":{"type":"string"},"type":"array"},"reason":{"minLength":1,"type":"string"},"secrets":{"items":{"type":"string"},"type":"array"},"shellCommands":{"items":{"type":"string"},"type":"array"},"toolCalls":{"items":{"type":"string"},"type":"array"}},"required":["authorized","reason","shellCommands","toolCalls","connectorCalls","networkCalls","fileEdits","secrets","callbacks"],"type":"object","unevaluatedProperties":false},"fixtureRef":{"properties":{"path":{"minLength":1,"pattern":"^(?!.*(?:^|/)\\.\\.(?:/|$))(?!.*(?:^|/)\\.(?:/|$))(?!.*//)[A-Za-z0-9._@-]+(?:/[A-Za-z0-9._@-]+)*$","type":"string"},"schemaId":{"const":"review-judgment-fixture.v0"},"sourceRef":{"minLength":1,"type":"string"}},"required":["path","schemaId","sourceRef"],"type":"object","unevaluatedProperties":false},"hiddenState":{"oneOf":[{"type":"null"},{"additionalProperties":true,"minProperties":1,"type":"object"}]},"rationale":{"maxLength":500,"minLength":1,"type":"string"},"requestedChanges":{"items":{"minLength":1,"type":"string"},"maxItems":8,"type":"array"},"reviewItemId":{"pattern":"^[a-z][a-z0-9.-]*$","type":"string"},"secondReviewRequired":{"type":"boolean"},"status":{"enum":["approved","rejected","changes_requested","deferred"]}},"required":["decisionId","decisionKey","reviewItemId","status","rationale","requestedChanges","evidenceRefs","fixtureRef","secondReviewRequired","execution","catalogOverride","hiddenState"],"type":"object","unevaluatedProperties":false},{"type":"null"}]},"expectedPromotionStatus":{"enum":["allowed","blocked","review_required"]},"finding":{"oneOf":[{"properties":{"affectedArtifactPaths":{"items":{"minLength":1,"pattern":"^(?!.*(?:^|/)\\.\\.(?:/|$))(?!.*(?:^|/)\\.(?:/|$))(?!.*//)[A-Za-z0-9._@-]+(?:/[A-Za-z0-9._@-]+)*$","type":"string"},"minItems":1,"type":"array"},"authority":{"properties":{"approves":{"type":"boolean"},"defers":{"type":"boolean"},"executes":{"type":"boolean"},"mutates":{"type":"boolean"},"overridesPolicy":{"type":"boolean"},"promotes":{"type":"boolean"},"rejects":{"type":"boolean"},"renders":{"type":"boolean"},"requestsChanges":{"type":"boolean"},"routes":{"type":"boolean"}},"required":["approves","rejects","requestsChanges","defers","routes","promotes","mutates","renders","executes","overridesPolicy"],"type":"object","unevaluatedProperties":false},"dimension":{"enum":["activity_fit","contract_quality","evidence_quality","handoff_quality"]},"evidenceRefs":{"items":{"properties":{"hash":{"pattern":"^[a-f0-9]{64}$","type":"string"},"hashAlgorithm":{"const":"sha256"},"path":{"minLength":1,"pattern":"^(?!.*(?:^|/)\\.\\.(?:/|$))(?!.*(?:^|/)\\.(?:/|$))(?!.*//)[A-Za-z0-9._@-]+(?:/[A-Za-z0-9._@-]+)*$","type":"string"},"schemaId":{"minLength":1,"type":"string"},"sourceEvidenceHash":{"pattern":"^[a-f0-9]{64}$","type":"string"},"sourceRef":{"type":["string","null"]}},"required":["path","schemaId","hashAlgorithm","hash"],"type":"object","unevaluatedProperties":false},"minItems":1,"type":"array"},"findingId":{"pattern":"^[a-z][a-z0-9.-]*$","type":"string"},"rationale":{"minLength":1,"type":"string"},"result":{"enum":["pass","warn","fail"]},"severity":{"enum":["info","warning","error"]}},"required":["findingId","dimension","severity","result","rationale","evidenceRefs","affectedArtifactPaths","authority"],"type":"object","unevaluatedProperties":false},{"type":"null"}]},"fixtureId":{"pattern":"^[a-z][a-z0-9.-]*$","type":"string"},"fixtureKind":{"enum":["surfaceops-decision","judgmentkit-evaluation"]},"provenance":{"properties":{"generatedAt":{"const":"1970-01-01T00:00:00.000Z"},"generator":{"minLength":1,"type":"string"},"sourceRefs":{"items":{"minLength":1,"type":"string"},"type":"array"}},"required":["generatedAt","generator","sourceRefs"],"type":"object","unevaluatedProperties":false},"reviewItemRef":{"properties":{"path":{"const":"artifacts/p3/review-queue.json"},"reviewItemId":{"pattern":"^[a-z][a-z0-9.-]*$","type":"string"},"runId":{"minLength":1,"type":"string"},"schemaId":{"const":"agent-review-queue.v0"},"taskId":{"pattern":"^[a-z][a-z0-9.-]*$","type":"string"}},"required":["path","schemaId","runId","reviewItemId","taskId"],"type":"object","unevaluatedProperties":false},"reviewer":{"properties":{"accountId":{"type":"null"},"displayName":{"minLength":1,"type":"string"},"hostUser":{"type":"null"},"reviewerId":{"pattern":"^[a-z][a-z0-9.-]*$","type":"string"},"role":{"pattern":"^[a-z][a-z0-9.-]*$","type":"string"},"sourceRef":{"minLength":1,"type":"string"}},"required":["reviewerId","role","displayName","hostUser","accountId","sourceRef"],"type":"object","unevaluatedProperties":false},"schemaId":{"const":"review-judgment-fixture.v0"},"upstream":{"properties":{"orchestrationEvidenceRef":{"properties":{"hash":{"pattern":"^[a-f0-9]{64}$","type":"string"},"hashAlgorithm":{"const":"sha256"},"path":{"minLength":1,"pattern":"^(?!.*(?:^|/)\\.\\.(?:/|$))(?!.*(?:^|/)\\.(?:/|$))(?!.*//)[A-Za-z0-9._@-]+(?:/[A-Za-z0-9._@-]+)*$","type":"string"},"schemaId":{"minLength":1,"type":"string"},"sourceRef":{"type":["string","null"]}},"required":["path","schemaId","hashAlgorithm","hash"],"type":"object","unevaluatedProperties":false},"orchestrationReportRef":{"properties":{"hash":{"pattern":"^[a-f0-9]{64}$","type":"string"},"hashAlgorithm":{"const":"sha256"},"path":{"minLength":1,"pattern":"^(?!.*(?:^|/)\\.\\.(?:/|$))(?!.*(?:^|/)\\.(?:/|$))(?!.*//)[A-Za-z0-9._@-]+(?:/[A-Za-z0-9._@-]+)*$","type":"string"},"schemaId":{"minLength":1,"type":"string"},"sourceEvidenceHash":{"pattern":"^[a-f0-9]{64}$","type":"string"},"sourceRef":{"type":["string","null"]}},"required":["path","schemaId","hashAlgorithm","hash"],"type":"object","unevaluatedProperties":false},"reviewQueueRef":{"properties":{"hash":{"pattern":"^[a-f0-9]{64}$","type":"string"},"hashAlgorithm":{"const":"sha256"},"path":{"minLength":1,"pattern":"^(?!.*(?:^|/)\\.\\.(?:/|$))(?!.*(?:^|/)\\.(?:/|$))(?!.*//)[A-Za-z0-9._@-]+(?:/[A-Za-z0-9._@-]+)*$","type":"string"},"schemaId":{"minLength":1,"type":"string"},"sourceEvidenceHash":{"pattern":"^[a-f0-9]{64}$","type":"string"},"sourceRef":{"type":["string","null"]}},"required":["path","schemaId","hashAlgorithm","hash"],"type":"object","unevaluatedProperties":false}},"required":["orchestrationEvidenceRef","reviewQueueRef","orchestrationReportRef"],"type":"object","unevaluatedProperties":false},"version":{"pattern":"^[0-9]+\\.[0-9]+\\.[0-9]+$","type":"string"}},"required":["schemaId","version","fixtureId","fixtureKind","upstream","reviewItemRef","reviewer","decision","finding","expectedPromotionStatus","provenance"],"schemaId":"review-judgment-fixture.v0","title":"review-judgment-fixture.v0","type":"object","unevaluatedProperties":false,"version":"0.0.0"}