{"decision":{"catalogOverride":null,"decisionId":"decision.request-changes","decisionKey":"review.review-required-work#request-changes","evidenceRefs":[{"hash":"65c824168519bd20bcf64a75579d070c56c80197be9b7c8e524bb7397f9d1fa1","hashAlgorithm":"sha256","path":"artifacts/p3/evidence.json","schemaId":"agent-orchestration-evidence.v0","sourceRef":null},{"hash":"c43bcb9287f1d4c13137b6265c95a7ee8664efbd665e383811fc1125ad5bacbd","hashAlgorithm":"sha256","path":"artifacts/p3/review-queue.json","schemaId":"agent-review-queue.v0","sourceEvidenceHash":"65c824168519bd20bcf64a75579d070c56c80197be9b7c8e524bb7397f9d1fa1","sourceRef":null}],"execution":{"authorized":false,"callbacks":[],"connectorCalls":[],"fileEdits":[],"networkCalls":[],"reason":"P4 review and judgment artifacts are deterministic proof records and authorize no work-order execution.","secrets":[],"shellCommands":[],"toolCalls":[]},"fixtureRef":{"path":"fixtures/p4/valid/request-changes.review-judgment.json","schemaId":"review-judgment-fixture.v0","sourceRef":"fixture://p4/valid/request-changes#/decision/status"},"hiddenState":null,"rationale":"Reviewer requests explicit downstream implementation proof before any future execution authority.","requestedChanges":["Add later-phase execution authorization proof before consuming this queue item."],"reviewItemId":"review.review-required-work","secondReviewRequired":false,"status":"changes_requested"},"expectedPromotionStatus":"blocked","finding":null,"fixtureId":"request-changes","fixtureKind":"surfaceops-decision","provenance":{"generatedAt":"1970-01-01T00:00:00.000Z","generator":"interfacectl-p4-materialize","sourceRefs":["fixture://p4/valid/request-changes#/decision/status"]},"reviewItemRef":{"path":"artifacts/p3/review-queue.json","reviewItemId":"review.review-required-work","runId":"p3-bea4f37aac1a5a666671bf0ee57795c2","schemaId":"agent-review-queue.v0","taskId":"review-required-work"},"reviewer":{"accountId":null,"displayName":"SurfaceOps fixture reviewer","hostUser":null,"reviewerId":"surfaceops-reviewer","role":"surfaceops-reviewer","sourceRef":"fixture://p4/valid/request-changes#/decision/status"},"schemaId":"review-judgment-fixture.v0","upstream":{"orchestrationEvidenceRef":{"hash":"65c824168519bd20bcf64a75579d070c56c80197be9b7c8e524bb7397f9d1fa1","hashAlgorithm":"sha256","path":"artifacts/p3/evidence.json","schemaId":"agent-orchestration-evidence.v0","sourceRef":null},"orchestrationReportRef":{"hash":"88647a79cdd469bf7556fa8fab0469e6ed5148b29e6355df02a822528292e357","hashAlgorithm":"sha256","path":"artifacts/p3/agent-orchestration-report.json","schemaId":"agent-orchestration-report.v0","sourceEvidenceHash":"65c824168519bd20bcf64a75579d070c56c80197be9b7c8e524bb7397f9d1fa1","sourceRef":null},"reviewQueueRef":{"hash":"c43bcb9287f1d4c13137b6265c95a7ee8664efbd665e383811fc1125ad5bacbd","hashAlgorithm":"sha256","path":"artifacts/p3/review-queue.json","schemaId":"agent-review-queue.v0","sourceEvidenceHash":"65c824168519bd20bcf64a75579d070c56c80197be9b7c8e524bb7397f9d1fa1","sourceRef":null}},"version":"0.0.0"}