{"decision":{"catalogOverride":null,"decisionId":"decision.second-review-required","decisionKey":"review.review-required-work#second-review-required","evidenceRefs":[{"hash":"9a1ae85b240561ab39e427ff5495beeff03088a17f623d2ce35cb633ca9914d7","hashAlgorithm":"sha256","path":"artifacts/p3/evidence.json","schemaId":"agent-orchestration-evidence.v0","sourceRef":null},{"hash":"57a5a357f1c0c47604f58b719f25ff0edaf919c25ac0c7a63f91f6f773b49d07","hashAlgorithm":"sha256","path":"artifacts/p3/review-queue.json","schemaId":"agent-review-queue.v0","sourceEvidenceHash":"9a1ae85b240561ab39e427ff5495beeff03088a17f623d2ce35cb633ca9914d7","sourceRef":null}],"execution":{"authorized":false,"callbacks":[],"connectorCalls":[],"fileEdits":[],"networkCalls":[],"reason":"P4 review and judgment artifacts are deterministic proof records and authorize no work-order execution.","secrets":[],"shellCommands":[],"toolCalls":[]},"fixtureRef":{"path":"fixtures/p4/review/second-review-required.review-judgment.json","schemaId":"review-judgment-fixture.v0","sourceRef":"fixture://p4/review/second-review-required#/decision/secondReviewRequired"},"hiddenState":null,"rationale":"Reviewer defers the queue item pending a second reviewer before downstream eligibility.","requestedChanges":[],"reviewItemId":"review.review-required-work","secondReviewRequired":true,"status":"deferred"},"expectedPromotionStatus":"review_required","finding":null,"fixtureId":"second-review-required","fixtureKind":"surfaceops-decision","provenance":{"generatedAt":"1970-01-01T00:00:00.000Z","generator":"interfacectl-p4-materialize","sourceRefs":["fixture://p4/review/second-review-required#/decision/secondReviewRequired"]},"reviewItemRef":{"path":"artifacts/p3/review-queue.json","reviewItemId":"review.review-required-work","runId":"p3-ca0ed6b878b6ac1397c5e98897cc0846","schemaId":"agent-review-queue.v0","taskId":"review-required-work"},"reviewer":{"accountId":null,"displayName":"SurfaceOps fixture reviewer","hostUser":null,"reviewerId":"surfaceops-reviewer","role":"surfaceops-reviewer","sourceRef":"fixture://p4/review/second-review-required#/decision/secondReviewRequired"},"schemaId":"review-judgment-fixture.v0","upstream":{"orchestrationEvidenceRef":{"hash":"9a1ae85b240561ab39e427ff5495beeff03088a17f623d2ce35cb633ca9914d7","hashAlgorithm":"sha256","path":"artifacts/p3/evidence.json","schemaId":"agent-orchestration-evidence.v0","sourceRef":null},"orchestrationReportRef":{"hash":"50a7dd81afceb5437d51e3e00ca85d082d38408e5b7648a31569a8bc6afb5c72","hashAlgorithm":"sha256","path":"artifacts/p3/agent-orchestration-report.json","schemaId":"agent-orchestration-report.v0","sourceEvidenceHash":"9a1ae85b240561ab39e427ff5495beeff03088a17f623d2ce35cb633ca9914d7","sourceRef":null},"reviewQueueRef":{"hash":"57a5a357f1c0c47604f58b719f25ff0edaf919c25ac0c7a63f91f6f773b49d07","hashAlgorithm":"sha256","path":"artifacts/p3/review-queue.json","schemaId":"agent-review-queue.v0","sourceEvidenceHash":"9a1ae85b240561ab39e427ff5495beeff03088a17f623d2ce35cb633ca9914d7","sourceRef":null}},"version":"0.0.0"}